{"classification":"qualification_candidate","conformance":[],"descriptor_digest_binding":{"algorithm":"sha256","canonicalization":"raw_artifact_bytes","registry_field":"artifact_digest"},"descriptor_version":"1.1","id":"phase.native.ntfs.experiment.version2.authority.v1","implementation":{"artifact":"phase_tool/mutation/ntfs/experimental_version2_authority.py","artifact_digest":"sha256:e7c91eb99777202de8f4e8fc8e684695da1b1e6aafe0616e0fe1180421ae4464","id":"phase.native.ntfs.experiment.version2.authority","version":"1.0.0"},"limitations":["Explicit private publish_new_version.v2 experiment only; no qualification or provided guarantee coverage.","One exact run/captured candidate and two disjoint native NTFS roots; private ext4 MIX evidence/preparation.","All six unchanged contract obligations remain required; A05/G01 and fault coverage remain NOT_VERIFIED.","Existing Core intent, idempotency, objects-first semantics, worker, receipts and independent inspect remain required.","No FULL, whole-transaction atomicity, bundle, append, journal or Source/Knowledge qualification is claimed."],"provided_guarantees":[],"storage_scope":{"cooperating_processes_only":true,"filesystem":"Experimental local NTFS target; qualified private ext4 MIX evidence/preparation.","mount_boundary":"Only fixed Version2 experimental startup with exact two-root context; ordinary startup refuses."},"version":"1.0.0","vocabulary":{"descriptor_digest":"sha256:f7b158004b0bf7041286269c239c381cfd60db5987c6bf2173c645d5ac146624","id":"phase.mutation-guarantees","version":"1.0.0"}}