{"classification":"qualification_candidate","conformance":[],"descriptor_digest_binding":{"algorithm":"sha256","canonicalization":"raw_artifact_bytes","registry_field":"artifact_digest"},"descriptor_version":"1.1","id":"phase.native.ntfs.experiment.version1.authority.v1","implementation":{"artifact":"phase_tool/mutation/ntfs/experimental_version1_authority.py","artifact_digest":"sha256:d471be30e07b3af58ef5804d83eed66fd634a33ab3415c35472f2052237906fd","id":"phase.native.ntfs.experiment.version1.authority","version":"1.0.0"},"limitations":["Explicit private publish_new_version.v1 experiment only; no production qualification or guarantee coverage.","One run and exact full candidate/input/root; deterministic archive follows expected_current_digest after the complete original parser.","All five original contract obligations remain required; A05/G01 and native size/deadline/fault coverage remain NOT_VERIFIED.","Existing Core intent, locks, idempotency, Version1 worker effect, receipt and independent inspect remain required.","A fresh physically disjoint owned domain is required; this composition provides no cross-contract history.","No FULL, atomicity, automatic recovery, bundle, append, journal or Source/Knowledge qualification is claimed."],"provided_guarantees":[],"storage_scope":{"cooperating_processes_only":true,"filesystem":"Experimental local NTFS target; qualified private ext4 MIX evidence/preparation.","mount_boundary":"Only fixed Version1 experimental startup with exact context; ordinary startup refuses."},"version":"1.0.0","vocabulary":{"descriptor_digest":"sha256:f7b158004b0bf7041286269c239c381cfd60db5987c6bf2173c645d5ac146624","id":"phase.mutation-guarantees","version":"1.0.0"}}