{"classification":"qualification_candidate","conformance":[],"descriptor_digest_binding":{"algorithm":"sha256","canonicalization":"raw_artifact_bytes","registry_field":"artifact_digest"},"descriptor_version":"1.1","id":"phase.native.ntfs.experiment.bundle2.authority.v1","implementation":{"artifact":"phase_tool/mutation/ntfs/experimental_bundle2_authority_v3.py","artifact_digest":"sha256:742d86fa908934770744964c8764c9e0c8632254d7a99e2a46f5de92546b1a9a","id":"phase.native.ntfs.experiment.bundle2.authority","version":"1.0.2"},"limitations":["Private isolated bundle_create.v2 experiment only; no qualification or guarantee coverage.","Exact native contract/mechanism, manifest, ordered members, physical root and frozen original inputs.","Same Phase Core, intent, EvidenceStore, prepared/binding records, root coordination, worker and receipts.","PREPARED/ACK in the original exchange before directory NOREPLACE; existing record1.0 formats unchanged.","Source-only recovery-capable experimental generation. Portable models and physical Windows recovery have not been executed or qualified.","A05/G01, complete native range/failure/MCP/install/rollback coverage remain NOT_VERIFIED.","No supported NTFS, FULL, append, journal or Source/Knowledge qualification is claimed."],"provided_guarantees":[],"storage_scope":{"cooperating_processes_only":true,"filesystem":"Experimental local NTFS target; qualified private ext4 MIX evidence/preparation.","mount_boundary":"Fixed bundle2 experimental startup only; ordinary startup refuses."},"version":"1.0.2","vocabulary":{"descriptor_digest":"sha256:f7b158004b0bf7041286269c239c381cfd60db5987c6bf2173c645d5ac146624","id":"phase.mutation-guarantees","version":"1.0.0"}}