{"classification":"qualification_candidate","conformance":[],"descriptor_digest_binding":{"algorithm":"sha256","canonicalization":"raw_artifact_bytes","registry_field":"artifact_digest"},"descriptor_version":"1.1","id":"phase.native.ntfs.candidate.authority.v5","implementation":{"artifact":"phase_tool/mutation/ntfs/authority.py","artifact_digest":"sha256:a568ea8fe3a05369e044725f6f12f8b803b076206ddeb9d8d777944f0bffde13","id":"phase.native.ntfs.authority","version":"1.4.0"},"limitations":["UNQUALIFIED exact three-role composition candidate: file_create.v1, publish_new_version.v1, file_create.v2. No production/native admission or conformance claims.","A05 genuine Windows SYMLINK and G01 namespace/runtime/lifetime/orphan exclusion remain NOT_VERIFIED. No bypass or policy changes.","Manifest1.4 and history-set1.1 bind exactly three current contract packages to one complete physical/evidence/preparation domain. Static equality and hashes do not authenticate startup or continuous exclusion.","Existing Core owns intent, idempotency, operational history lock, receipts and recovery; existing physical-root mutex is unchanged. No parallel journal, queue or document version store.","Initial isolated V7 deployment must use its own physically disjoint target domain. A new evidence namespace must NEVER hide V5/V6 writers or unresolved operations on the same physical root. Old history migration is not supported.","File1 retains 1 MiB. Version1 retains 16 MiB payload/current/archive limits. File2 retains 2 GiB with bounded first-pass/replay; actual native throughput/finalization within30s is NOT_VERIFIED.","Planned full-content verification is not terminal closure. Native planned/executed history requires the existing qualified-profile and exact terminal-proof policy; proofless native originals still fail closed.","Old V1-V6 registries/descriptors and launch templates remain immutable and require their matching historical artifacts. New composition does not admit old history by relaxed comparison.","FULL remains disabled. Bundles, publish_new_version.v2, append/journal, Source/Knowledge admission, complete MIX family, native CLI/MCP and native rollback are NOT_VERIFIED."],"provided_guarantees":[],"storage_scope":{"cooperating_processes_only":true,"filesystem":"UNQUALIFIED candidate: exact local NTFS plus own ext4 MIX evidence/preparation only.","mount_boundary":"No native Core admission until the exact Windows/Docker/source-wheel/namespace environment has passed mandatory qualification."},"version":"1.0.0","vocabulary":{"descriptor_digest":"sha256:f7b158004b0bf7041286269c239c381cfd60db5987c6bf2173c645d5ac146624","id":"phase.mutation-guarantees","version":"1.0.0"}}