{"classification":"qualification_candidate","conformance":[],"descriptor_digest_binding":{"algorithm":"sha256","canonicalization":"raw_artifact_bytes","registry_field":"artifact_digest"},"descriptor_version":"1.1","id":"phase.native.ntfs.candidate.authority.v2","implementation":{"artifact":"phase_tool/mutation/ntfs/authority.py","artifact_digest":"sha256:53a72df83d616a6873956c948d532aba89e780e15dccc05dbdb5b6ccdd84bccf","id":"phase.native.ntfs.authority","version":"1.1.0"},"limitations":["This descriptor grants no production storage guarantees and has no conformance claims.","True Windows SYMLINK A05 and G01 remain NOT_VERIFIED; no policy or privilege workaround.","First implementation subset is existing file_create.v1, one exclusive effect, at most 1 MiB, existing target parents.","FULL, version updates, bundles, append, journal and Source/Knowledge admission are not qualified by this candidate.","A raw hash, origin match, Docker metadata, READY, ACK or exit code alone does not authenticate loaded code or establish effect success.","The accepted launcher, CPython, Docker daemon, installation data and complete source-wheel namespace need qualified lifetime immutability.","Fixed inspection-only startup reuses observe_file1.1/finalcommand1.0. Historical candidate authority.v1 needs its matching old wheel; it is not rebound to this source."],"provided_guarantees":[],"storage_scope":{"cooperating_processes_only":true,"filesystem":"UNQUALIFIED candidate: exact local NTFS plus own ext4 MIX evidence/preparation only.","mount_boundary":"No native Core admission until the exact Windows/Docker/source-wheel/namespace environment has passed mandatory qualification."},"version":"1.0.0","vocabulary":{"descriptor_digest":"sha256:f7b158004b0bf7041286269c239c381cfd60db5987c6bf2173c645d5ac146624","id":"phase.mutation-guarantees","version":"1.0.0"}}
