{"classification":"qualification_candidate","conformance":[],"descriptor_digest_binding":{"algorithm":"sha256","canonicalization":"raw_artifact_bytes","registry_field":"artifact_digest"},"descriptor_version":"1.1","id":"phase.native.ntfs.candidate.authority.v4","implementation":{"artifact":"phase_tool/mutation/ntfs/authority.py","artifact_digest":"sha256:ef8f35705dcee62d13e619e15f2d23b1740bfcdca441007d606bc810d78bdb54","id":"phase.native.ntfs.authority","version":"1.3.0"},"limitations":["UNQUALIFIED file_create.v2-only candidate. No production/native admission or conformance claims.","A05 real Windows SYMLINK and G01 namespace/runtime/lifetime/orphan exclusion remain NOT_VERIFIED. No bypass or policy changes.","Fixed file_create.v2 contract limit 2 GiB, bounded256KiB first-pass/replay, one owned channel/worker/GO. Actual full native throughput and finalization within30s remain NOT_VERIFIED.","Existing Core owns intent, idempotency, evidence, receipt and inspect. This candidate owns no parallel journal, queue or document version store.","No cooperative cross-contract history is admitted. The active evidence domain must retain fail-closed foreign/unresolved-original checks. A separate evidence namespace must NEVER hide earlier writers/unresolved operations on the same physical target root.","Initial isolated file2 environment must use its own physically disjoint target root; reusing any V5 target domain requires supported shared history/domain qualification first.","Old V1-V5 descriptors, registry snapshots, launch formats and exact two-role history remain immutable; use their matching historical artifacts.","FULL, publish_bundle, publish_new_version.v2, append/journal and Source/Knowledge admission are not qualified. MIX full contract family and native rollback remain NOT_VERIFIED.","Hashes, READY, ACK, declared PID and metadata do not authenticate a process or continuous namespace exclusion. Complete accepted artifact/runtime/namespace qualification is still mandatory."],"provided_guarantees":[],"storage_scope":{"cooperating_processes_only":true,"filesystem":"UNQUALIFIED candidate: exact local NTFS plus own ext4 MIX evidence/preparation only.","mount_boundary":"No native Core admission until the exact Windows/Docker/source-wheel/namespace environment has passed mandatory qualification."},"version":"1.0.0","vocabulary":{"descriptor_digest":"sha256:f7b158004b0bf7041286269c239c381cfd60db5987c6bf2173c645d5ac146624","id":"phase.mutation-guarantees","version":"1.0.0"}}