{"classification":"qualification_candidate","conformance":[],"descriptor_digest_binding":{"algorithm":"sha256","canonicalization":"raw_artifact_bytes","registry_field":"artifact_digest"},"descriptor_version":"1.1","id":"phase.native.ntfs.experiment.file1","implementation":{"artifact":"phase_tool/mutation/ntfs/experimental_file1.py","artifact_digest":"sha256:2724514e2f8c471248b022d303c8f757322aea830e070ff4151f9c983613ecc6","id":"phase.native.ntfs.experiment.file1","version":"1.0.0"},"limitations":["Explicit private file_create.v1 experiment only; no production qualification or guarantee coverage.","One run, exact candidate/payload/root and mandatory evidence attachment. A05/G01 remain NOT_VERIFIED.","Existing Core, native worker, immutable evidence and truthful terminal classification remain required.","Hashes bind the accepted installation; they do not resist privileged replacement of the entire runtime.","No FULL, bundles, version changes, append, journal or Source/Knowledge qualification is claimed."],"provided_guarantees":[],"storage_scope":{"cooperating_processes_only":true,"filesystem":"Experimental local NTFS target; qualified private ext4 MIX evidence/preparation.","mount_boundary":"Only fixed experimental startup with explicit run-bound admission; ordinary startup refuses."},"version":"1.0.0","vocabulary":{"descriptor_digest":"sha256:f7b158004b0bf7041286269c239c381cfd60db5987c6bf2173c645d5ac146624","id":"phase.mutation-guarantees","version":"1.0.0"}}