{"classification":"qualification_candidate","conformance":[],"descriptor_digest_binding":{"algorithm":"sha256","canonicalization":"raw_artifact_bytes","registry_field":"artifact_digest"},"descriptor_version":"1.1","id":"phase.native.ntfs.experiment.file2.authority.v1","implementation":{"artifact":"phase_tool/mutation/ntfs/experimental_file2_authority.py","artifact_digest":"sha256:12de37704ec1863ea6aca9b07b1f835fea363b62d9be99286a8b88961f2412ba","id":"phase.native.ntfs.experiment.file2.authority","version":"1.0.0"},"limitations":["Explicit private file_create.v2 experiment only; no production qualification or guarantee coverage.","One run, exact candidate/input/root, mandatory evidence attachment and existing full stream/blob checks.","A05/G01 and native 2GiB/deadline/fault coverage remain NOT_VERIFIED.","Existing Core intent, locks, idempotency, native stream worker, receipt and independent inspect remain required.","A physically disjoint owned domain is required; this composition provides no cross-contract history.","No FULL, version, bundle, append, journal or Source/Knowledge qualification is claimed."],"provided_guarantees":[],"storage_scope":{"cooperating_processes_only":true,"filesystem":"Experimental local NTFS target; qualified private ext4 MIX evidence/preparation.","mount_boundary":"Only fixed file2 experimental startup with exact context; ordinary startup refuses."},"version":"1.0.0","vocabulary":{"descriptor_digest":"sha256:f7b158004b0bf7041286269c239c381cfd60db5987c6bf2173c645d5ac146624","id":"phase.mutation-guarantees","version":"1.0.0"}}