{"classification":"qualification_candidate","conformance":[],"descriptor_digest_binding":{"algorithm":"sha256","canonicalization":"raw_artifact_bytes","registry_field":"artifact_digest"},"descriptor_version":"1.1","id":"phase.native.ntfs.experiment.history.authority.v1","implementation":{"artifact":"phase_tool/mutation/ntfs/experimental_history_authority.py","artifact_digest":"sha256:5a1d5c9a334791064cdc615959b317ccb690d983a8b8535f88bade8bfec48bc2","id":"phase.native.ntfs.experiment.history.authority","version":"1.0.0"},"limitations":["Explicit private File1 -> Version1 -> Version1 experiment in one freshly owned synthetic domain; no production qualification or guarantee coverage.","Exactly three immutable per-run manifests/admissions selected by accepted configuration; one active write cap and read-only historical expectations.","Existing contract requirements, Core intent/idempotency/locks, Windows worker, original evidence and truthful receipt remain required.","Every actual original is scanned; unknown/proofless/unclosed work blocks further mutation. This is not a parallel journal or history index.","A05/full G01, replay/error/boundary/CLI-MCP/install/rollback and complete-family qualification remain NOT_VERIFIED.","No FULL, atomicity, automatic Version1 recovery, bundle, append, journal or Source/Knowledge qualification."],"provided_guarantees":[],"storage_scope":{"cooperating_processes_only":true,"filesystem":"Experimental local NTFS target; qualified private ext4 MIX evidence/preparation.","mount_boundary":"Only fixed experimental history startup/config1.2 with accepted three-run set; ordinary startup and old standalone contexts cannot activate it."},"version":"1.0.0","vocabulary":{"descriptor_digest":"sha256:f7b158004b0bf7041286269c239c381cfd60db5987c6bf2173c645d5ac146624","id":"phase.mutation-guarantees","version":"1.0.0"}}