{"classification":"qualification_candidate","conformance":[],"descriptor_digest_binding":{"algorithm":"sha256","canonicalization":"raw_artifact_bytes","registry_field":"artifact_digest"},"descriptor_version":"1.1","id":"phase.native.ntfs.experiment.bundle1.authority.v1","implementation":{"artifact":"phase_tool/mutation/ntfs/experimental_bundle1_authority.py","artifact_digest":"sha256:f72a8d7afb488fdc89fe011a18d4f146d26ded6f3322c0c6658050a1907ed798","id":"phase.native.ntfs.experiment.bundle1.authority","version":"1.0.0"},"limitations":["Private isolated bundle_create.v1 experiment only; no qualification or guarantee coverage.","Exact new native contract/mechanism binding, candidate, manifest, ordered member occurrences and physical root.","Same Phase Core, original intent, EvidenceStore, root coordination, worker and independently verified receipt/inspect.","One native directory NOREPLACE commit; unchanged phase_bundle_v1 owner1.0 uses actual same-HANDLE fstat identity.","A05/G01, full native bundle range/deadline/failure coverage remain NOT_VERIFIED.","No v2 recovery, FULL, append, journal or Source/Knowledge qualification is claimed."],"provided_guarantees":[],"storage_scope":{"cooperating_processes_only":true,"filesystem":"Experimental local NTFS target; qualified private ext4 MIX evidence/preparation.","mount_boundary":"Fixed bundle1 experimental startup only; ordinary startup refuses."},"version":"1.0.0","vocabulary":{"descriptor_digest":"sha256:f7b158004b0bf7041286269c239c381cfd60db5987c6bf2173c645d5ac146624","id":"phase.mutation-guarantees","version":"1.0.0"}}
